{"artifact_kind":"fbt_atlas_v1_raw_cell_table","assumption_ids":["ASM-FBT-0001","ASM-FBT-0002","ASM-FBT-0003","ASM-FBT-0004"],"claim_ids":["CLM-FBT-ATLAS-001"],"command":"uv run fts fbt atlas-v1-raw-cells","created_at_utc":"2026-07-02T08:09:19Z","environment":{"dependency_lock_sha256":"6b81fceadcb3fe17172ce56a239b581332675e7045058459a5871f2982e609c8","platform":"Windows-10-10.0.19045-SP0","python_version":"3.12.13"},"epistemic_status":"E","error":null,"git":{"branch":"codex/stage4-atlas-v1-capsule","commit":"4a015ca85aed88cecab0c4cda82a384b530ff3a9","detached":false,"dirty":false},"implementation":{"package":"fts-lab","version":"0.1.0"},"inputs":[{"path":"C:\\Users\\user\\Fitness, Truth & Structure Lab\\experiments\\configs\\fbt_atlas_v1_draft.json","sha256":"0f8e927ca0f5bd291689fb8879e7d4b404d3514216e789f33118182cd7b8d08d"}],"manifest_id":"ART-TASK-004-FBT-ATLAS-V1-RAW-CELLS-MANIFEST-20260702T080919Z-0AE3BB9C","outputs":[{"path":"C:\\Users\\user\\Fitness, Truth & Structure Lab\\results\\raw\\EXP-TASK-004-FBT-ATLAS-V1-RAW-CELLS-20260702T080919Z-0AE3BB9C\\fbt_atlas_v1_raw_cells.json","sha256":"582e7e50fd8b1bfab149feab6e00d80cd95bda29268ff6fec99e0a5ed4748613"}],"parameters":{"aggregate_report":false,"config_path":"C:\\Users\\user\\Fitness, Truth & Structure Lab\\experiments\\configs\\fbt_atlas_v1_draft.json","edge_policy_id":"rdr0004_stage4_edge_policies","grid_version":"fbt_atlas_v1_draft","primary_comparison_id":"truth_map_vs_fitness_only_expected","raw_cell_count":144,"raw_cell_table_filename":"fbt_atlas_v1_raw_cells.json","result_level":"raw_cells_only"},"run_id":"EXP-TASK-004-FBT-ATLAS-V1-RAW-CELLS-20260702T080919Z-0AE3BB9C","schema_version":"1.0","seed":null,"source_ids":["SRC-FBT-2021"],"status":"completed","task_ids":["TASK-004-FBT-ATLAS-V1-SPEC","TASK-004-FBT-ATLAS-V1-ENGINE"]}