{"artifact_kind":"fff_stage1_publication_tables","assumption_ids":["ASM-FFF-0001"],"claim_ids":["CLM-FFF-ADM-001","CLM-FFF-ORD-001","CLM-FFF-CYC-001","CLM-FFF-CYC-002"],"command":"uv run fts fff publication-tables --sweep-manifest experiments\\manifests\\ART-TASK-001-SWEEP-MANIFEST-20260625T192538Z-FBD5EA2B.json","created_at_utc":"2026-06-25T19:25:46Z","environment":{"dependency_lock_sha256":"6b81fceadcb3fe17172ce56a239b581332675e7045058459a5871f2982e609c8","platform":"Windows-10-10.0.19045-SP0","python_version":"3.12.13"},"epistemic_status":"C","error":null,"git":{"branch":"stage1-p1-release-capsule","commit":"ca23c56232a1d108b675418fcb55cda883a3dc6a","detached":false,"dirty":false},"implementation":{"package":"fts-lab","version":"0.1.0"},"inputs":[{"path":"C:\\Users\\user\\Fitness, Truth & Structure Lab\\experiments\\manifests\\ART-TASK-001-SWEEP-MANIFEST-20260625T192538Z-FBD5EA2B.json","sha256":"ee7a2f27c9c94be5aba5165091d84b93a5a3a1c6b16fa30de5f95dfb225a2a01"},{"path":"C:\\Users\\user\\Fitness, Truth & Structure Lab\\results\\raw\\EXP-TASK-001-SWEEP-20260625T192538Z-FBD5EA2B\\fff_stage1_counts.csv","sha256":"6f391a2891e1274d2e1b8240cbc35329bbe6a40326f71ba20b04f642263d5bab"}],"manifest_id":"ART-TASK-001-PUBTABLES-MANIFEST-20260625T192546Z-D763EFE3","outputs":[{"path":"C:\\Users\\user\\Fitness, Truth & Structure Lab\\results\\derived\\EXP-TASK-001-PUBTABLES-20260625T192546Z-D763EFE3\\stage1_fff_publication_counts.csv","sha256":"a0295ae0a52fb558c2116481da46fa449c622ea83e86c4f989b0b958479a9d51"},{"path":"C:\\Users\\user\\Fitness, Truth & Structure Lab\\results\\reports\\EXP-TASK-001-PUBTABLES-20260625T192546Z-D763EFE3\\stage1_fff_publication_tables.md","sha256":"2e349b9c299d81ee261da929738e5c98fb743a0bdc021057b2b02f4ae8253877"}],"parameters":{"input_row_count":112,"output_row_count":16,"report_filename":"stage1_fff_publication_tables.md","source_sweep_manifest_id":"ART-TASK-001-SWEEP-MANIFEST-20260625T192538Z-FBD5EA2B","source_sweep_run_id":"EXP-TASK-001-SWEEP-20260625T192538Z-FBD5EA2B","summary_csv_filename":"stage1_fff_publication_counts.csv","sweep_manifest_path":"C:\\Users\\user\\Fitness, Truth & Structure Lab\\experiments\\manifests\\ART-TASK-001-SWEEP-MANIFEST-20260625T192538Z-FBD5EA2B.json"},"run_id":"EXP-TASK-001-PUBTABLES-20260625T192546Z-D763EFE3","schema_version":"1.0","seed":null,"source_ids":["SRC-FFF-2020"],"status":"completed","task_ids":["TASK-001-PUBTABLES"]}