{"artifact_kind":"fbt_numerical_appendix_reproduction","assumption_ids":[],"claim_ids":["CLM-FBT-APP-001","CLM-FBT-APP-002","CLM-FBT-APP-003","CLM-FBT-APP-004"],"command":"uv run fts fbt reproduce-numerical-example","created_at_utc":"2026-06-25T22:20:00Z","environment":{"dependency_lock_sha256":"6b81fceadcb3fe17172ce56a239b581332675e7045058459a5871f2982e609c8","platform":"Windows-10-10.0.19045-SP0","python_version":"3.12.13"},"epistemic_status":"R","error":null,"git":{"branch":"codex/stage2-fbt-numerical-appendix","commit":"23060471e8ade4e9d1790041ea49271f0002cd18","detached":false,"dirty":false},"implementation":{"package":"fts-lab","version":"0.1.0"},"inputs":[{"path":"C:\\Users\\user\\Fitness, Truth & Structure Lab\\experiments\\configs\\fbt_numerical_example.json","sha256":"2cba53cb7a7b5aa01e4c7b6a6f13b334b708f90419612f3c2eb82062b481a1cd"}],"manifest_id":"ART-TASK-002-FBT-NUMERICAL-MANIFEST-20260625T222000Z-2A277325","outputs":[{"path":"C:\\Users\\user\\Fitness, Truth & Structure Lab\\results\\derived\\EXP-TASK-002-FBT-NUMERICAL-20260625T222000Z-2A277325\\fbt_numerical_appendix.json","sha256":"b5dabb660739de45d4d943e64b5195b7e85236cfe8ce5d0f2a3c61412abeb509"},{"path":"C:\\Users\\user\\Fitness, Truth & Structure Lab\\results\\reports\\EXP-TASK-002-FBT-NUMERICAL-20260625T222000Z-2A277325\\fbt_numerical_appendix.md","sha256":"af7831b01b606eee35ced1734db1b86e93b230fd0a3262ac34a392880d07d565"}],"parameters":{"config_path":"C:\\Users\\user\\Fitness, Truth & Structure Lab\\experiments\\configs\\fbt_numerical_example.json","json_report_filename":"fbt_numerical_appendix.json","markdown_report_filename":"fbt_numerical_appendix.md"},"run_id":"EXP-TASK-002-FBT-NUMERICAL-20260625T222000Z-2A277325","schema_version":"1.0","seed":null,"source_ids":["SRC-FBT-2021"],"status":"completed","task_ids":["TASK-002-FBT-NUMERICAL"]}