{"artifact_kind":"fff_stage1_finite_count_sweep","assumption_ids":["ASM-FFF-0001"],"claim_ids":["CLM-FFF-ADM-001","CLM-FFF-ORD-001","CLM-FFF-CYC-001","CLM-FFF-CYC-002"],"command":"uv run fts fff sweep --config experiments\\configs\\fff_stage1_small.json","created_at_utc":"2026-06-25T19:25:38Z","environment":{"dependency_lock_sha256":"6b81fceadcb3fe17172ce56a239b581332675e7045058459a5871f2982e609c8","platform":"Windows-10-10.0.19045-SP0","python_version":"3.12.13"},"epistemic_status":"C","error":null,"git":{"branch":"stage1-p1-release-capsule","commit":"ca23c56232a1d108b675418fcb55cda883a3dc6a","detached":false,"dirty":false},"implementation":{"package":"fts-lab","version":"0.1.0"},"inputs":[{"path":"C:\\Users\\user\\Fitness, Truth & Structure Lab\\experiments\\configs\\fff_stage1_small.json","sha256":"9569f5aa05e7a1518e28485df711ece9e57986905c2719b81201099f8e8c65b8"}],"manifest_id":"ART-TASK-001-SWEEP-MANIFEST-20260625T192538Z-FBD5EA2B","outputs":[{"path":"C:\\Users\\user\\Fitness, Truth & Structure Lab\\results\\raw\\EXP-TASK-001-SWEEP-20260625T192538Z-FBD5EA2B\\fff_stage1_counts.csv","sha256":"6f391a2891e1274d2e1b8240cbc35329bbe6a40326f71ba20b04f642263d5bab"}],"parameters":{"codomain_sizes":[1,2,3,4],"config_path":"C:\\Users\\user\\Fitness, Truth & Structure Lab\\experiments\\configs\\fff_stage1_small.json","domain_sizes":[1,2,3,4],"include_admissible_cyclic_audit":false,"row_count":112},"run_id":"EXP-TASK-001-SWEEP-20260625T192538Z-FBD5EA2B","schema_version":"1.0","seed":null,"source_ids":["SRC-FFF-2020"],"status":"completed","task_ids":["TASK-001-SWEEP"]}