{"artifact_kind":"fbt_atlas_v1_aggregate_report","assumption_ids":["ASM-FBT-0001","ASM-FBT-0002","ASM-FBT-0003","ASM-FBT-0004"],"claim_ids":["CLM-FBT-ATLAS-001"],"command":"uv run fts fbt atlas-v1-aggregate --raw-cells C:\\Users\\user\\Fitness, Truth & Structure Lab\\results\\raw\\EXP-TASK-004-FBT-ATLAS-V1-RAW-CELLS-20260702T080919Z-0AE3BB9C\\fbt_atlas_v1_raw_cells.json","created_at_utc":"2026-07-02T08:09:24Z","environment":{"dependency_lock_sha256":"6b81fceadcb3fe17172ce56a239b581332675e7045058459a5871f2982e609c8","platform":"Windows-10-10.0.19045-SP0","python_version":"3.12.13"},"epistemic_status":"E","error":null,"git":{"branch":"codex/stage4-atlas-v1-capsule","commit":"4a015ca85aed88cecab0c4cda82a384b530ff3a9","detached":false,"dirty":false},"implementation":{"package":"fts-lab","version":"0.1.0"},"inputs":[{"path":"C:\\Users\\user\\Fitness, Truth & Structure Lab\\results\\raw\\EXP-TASK-004-FBT-ATLAS-V1-RAW-CELLS-20260702T080919Z-0AE3BB9C\\fbt_atlas_v1_raw_cells.json","sha256":"582e7e50fd8b1bfab149feab6e00d80cd95bda29268ff6fec99e0a5ed4748613"}],"manifest_id":"ART-TASK-004-FBT-ATLAS-V1-AGGREGATE-MANIFEST-20260702T080924Z-1A6A67BF","outputs":[{"path":"C:\\Users\\user\\Fitness, Truth & Structure Lab\\results\\derived\\EXP-TASK-004-FBT-ATLAS-V1-AGGREGATE-20260702T080924Z-1A6A67BF\\fbt_atlas_v1_aggregate.json","sha256":"2512ab5833a2da993b31af21b1db4c529837eeb5930f7d2764de201860767328"},{"path":"C:\\Users\\user\\Fitness, Truth & Structure Lab\\results\\reports\\EXP-TASK-004-FBT-ATLAS-V1-AGGREGATE-20260702T080924Z-1A6A67BF\\fbt_atlas_v1_report.md","sha256":"786e48e0495822828d128580fe87199a253fdff71ad7939d2b0049a0796848a6"}],"parameters":{"aggregate_json_filename":"fbt_atlas_v1_aggregate.json","aggregate_label":"grid_frequency","denominator_basis":"all_raw_cells","denominator_policy":"all_enumerated_cells","full_grid_run":false,"grid_version":"fbt_atlas_v1_draft","markdown_report_filename":"fbt_atlas_v1_report.md","raw_cell_count":144,"raw_cells_path":"C:\\Users\\user\\Fitness, Truth & Structure Lab\\results\\raw\\EXP-TASK-004-FBT-ATLAS-V1-RAW-CELLS-20260702T080919Z-0AE3BB9C\\fbt_atlas_v1_raw_cells.json","recomputes_cells":false,"result_level":"aggregate_from_raw_cells"},"run_id":"EXP-TASK-004-FBT-ATLAS-V1-AGGREGATE-20260702T080924Z-1A6A67BF","schema_version":"1.0","seed":null,"source_ids":["SRC-FBT-2021"],"status":"completed","task_ids":["TASK-004-FBT-ATLAS-V1-SPEC","TASK-004-FBT-ATLAS-V1-ENGINE","TASK-004-FBT-ATLAS-V1-AGGREGATE"]}