{"artifact_kind":"fbt_atlas_grid_v0_smoke","assumption_ids":["ASM-FBT-0001","ASM-FBT-0002","ASM-FBT-0003","ASM-FBT-0004"],"claim_ids":["CLM-FBT-ATLAS-001"],"command":"uv run fts fbt atlas-grid-v0-smoke","created_at_utc":"2026-07-02T06:36:59Z","environment":{"dependency_lock_sha256":"6b81fceadcb3fe17172ce56a239b581332675e7045058459a5871f2982e609c8","platform":"Windows-10-10.0.19045-SP0","python_version":"3.12.13"},"epistemic_status":"E","error":null,"git":{"branch":"codex/stage4-p4-capsule","commit":"ed55ba337b8d3f03f80b12bfd7c566ce47ae57a6","detached":false,"dirty":false},"implementation":{"package":"fts-lab","version":"0.1.0"},"inputs":[{"path":"C:\\Users\\user\\Fitness, Truth & Structure Lab\\experiments\\configs\\fbt_atlas_v0.json","sha256":"4b933097880d1e1756d62b0af04cff39131ca5e5cc85267df829d50ad17e8556"}],"manifest_id":"ART-TASK-004-FBT-ATLAS-GRID-V0-MANIFEST-20260702T063659Z-58A56618","outputs":[{"path":"C:\\Users\\user\\Fitness, Truth & Structure Lab\\results\\derived\\EXP-TASK-004-FBT-ATLAS-GRID-V0-20260702T063659Z-58A56618\\fbt_atlas_v0_smoke.json","sha256":"caba8ad12bb67f1137a7be8d6551c3234ad47768018b9634553b881bce6210b8"},{"path":"C:\\Users\\user\\Fitness, Truth & Structure Lab\\results\\reports\\EXP-TASK-004-FBT-ATLAS-GRID-V0-20260702T063659Z-58A56618\\fbt_atlas_v0_smoke.md","sha256":"ffbff5de5cca94bb67fb5ff702543f5006faa2cc7d2079282e6d973accfdcd6b"}],"parameters":{"aggregate_label":"grid_frequency","cell_count":24,"config_path":"C:\\Users\\user\\Fitness, Truth & Structure Lab\\experiments\\configs\\fbt_atlas_v0.json","denominator_policy":"all_enumerated_cells","grid_version":"fbt_atlas_v0","json_report_filename":"fbt_atlas_v0_smoke.json","markdown_report_filename":"fbt_atlas_v0_smoke.md"},"run_id":"EXP-TASK-004-FBT-ATLAS-GRID-V0-20260702T063659Z-58A56618","schema_version":"1.0","seed":null,"source_ids":["SRC-FBT-2021"],"status":"completed","task_ids":["TASK-004-FBT-ATLAS-GRID-V0"]}